donoraddress,index,donationdesc
"Highbury House, 75 Drayton Park, London N5 1BU",11bercow_john.htm,"two tickets to attend a football match on 7 March 2017, and associated hospitality; total value å£550"
"Covent Garden, London WC2E 9DD",1bridgen_andrew.htm,two tickets with a total value of å£540
"30 Gloucester Place, London, W1U 8PL",1smith_royston.htm,"two tickets for football match on Saturday 25 February 2017, with associated hospitality, estimated value å£528"
"Floor 2, Wellington House, 125-130 Strand, London WC2R 0AP",2doughty_stephen.htm,"three tickets to the Royal International Air Tattoo 2017, plus hospitality with a value of å£510 (å£170 per person), also an Airbus Pen (å£43) and A400M Model (å£43.99), total value å£596.99"
"Longford House, 19 Mount Ephraim Rd, Tunbridge Wells TN1 1EN",3heappey_james.htm,"two tickets for the Meetings and Incentive Travel Awards, value å£510"
"2nd Floor, Regent Arcade House, 19-25 Argyll Street, London W1F 7TS",1sharma_alok.htm,"two tickets to the Reading Festival, which is held in my constituency, total value å£510"
"Imperial House, Imperial Drive, Rayners Lane, Harrow HA2 7JW",2davies_philip.htm,"two tickets with hospitality to St Leger Races, value å£500 (å£250 each)"
"Tannadice Park, Dundee DD3 7JW",1hosie_stewart.htm,"Entry to Tannadice and hospitality for the season, value å£500"
"Tannadice Park, Dundee DD3 7JW",2hosie_stewart.htm,"Entry to Tannadice and hospitality for the current season for myself and an occasional guest, value å£500"
"Worthy Farm, Pilton, Shepton Mallet BA4 4BY",1black_mhairi.htm,"two tickets for Glastonbury 2016, where I gave a talk and took part in a political debate on the Left Field Stage, total value å£446"
"Lord's Cricket Ground, London NW8 8QZ",1fallon_michael.htm,"two tickets with hospitality, total value of å£400"
"Main Road, Morley, DE7 6DG",1latham_pauline.htm,"Tickets for football match, and associated hospitality, for myself and my husband, with a total value of å£400"
"75 High Holborn, London WC1V 6LS",2mcginn_conor.htm,"Attended Grand National and received hospitality at Aintree Racecourse, as a guest of the Jockey Club (who own Haydock Racecourse), total value å£399"
"Grant Way, Isleworth TW7 5QD",3fallon_michael.htm,"Two tickets with hospitality for the England vs South Africa test match at Lords, value å£392"
"Palliser House, Palliser Road, London W14 9EB",5bercow_john.htm,"two tickets to attend the ATP World Tour Finals on Sunday 20 November 2016, and associated hospitality; total value å£385"
"Red Hall, Red Hall Lane, Leeds LS17 8NB",1crabb_stephen.htm,Two tickets and hospitality at Old Trafford with a value of å£360
"23 King Street, St James', London SW1Y 8QY",1chope_christopher.htm,"Hospitality for myself and my wife at Fairford Air Tattoo, total estimated value å£350"
"One Stratford Place, Montfitchet Road, London E20 1EJ",11davies_philip.htm,two tickets to Coral Eclipse with a value of å£350 (å£175 each)
"30 Gloucester Place, London, W1U 8PL",3grayling_chris.htm,"two tickets with hospitality for the FA Community Shield, estimated value å£350"
"30 Gloucester Place, London W1U 8PL",4grayling_chris.htm,"two tickets with hospitality for the EFL Cup final, estimated value å£350"
"Imperial House, Imperial Drive, Rayners Lane, Harrow HA2 7JWAmount of donation, or nature and value if donation in kind: Ticket and hospitality at the Cheltenham Festival, value å£350Date received: 16 March 2017Date accepted: 16 March 2017Donor status: company, registration 00566221(Registered 04 April 2017)",1mcginn_conor.htm,"Ticket and hospitality at the Cheltenham Festival, value å£350"
"Gunnels Wood Road, Stevenage SG1 2AS",1howell_john.htm,"Hospitality at the Royal International Air Tattoo for myself and a member of staff, total value å£338"
"Coldra Woods, Newport, South Wales NP18 1HQ",4heappey_james.htm,Hospitality and overnight stay at the Celtic Manor totalling å£330
private,8bercow_john.htm,"two tickets to attend a football match on Wednesday 23 November 2016, with associated hospitality; value å£330"
"Floor 2, Wellington House, 125-130 Strand, London WC2R 0AP",1doughty_stephen.htm,"three tickets to the Royal International Air Tattoo plus hospitality, value å£318 (å£106 per person)"
"Church Road, Wimbledon, London SW19 5AE",2watson_tom.htm,"Two tickets for Wimbledon, including lunch, value å£302"
"Palliser House, Palliser Road, London W14 9EB",6bercow_john.htm,"two tickets to attend the ATP World Tour Finals on Monday 14 November 2016, and associated hospitality, value å£277"
"Palliser House, Palliser Road, London W14 9EB",7bercow_john.htm,"two tickets to attend the ATP World Tour Finals on Thursday 17 November 2016, and associated hospitality, value å£277"
"2 Wellington Place, Leeds LS1 4AP",10davies_philip.htm,three tickets for League 1 Play Off with a value of å£255 (å£85 each)
"National Tennis Centre, 100 Priory Lane, Roehampton, London SW15 5JQ",1leslie_chris.htm,Two tickets to All England Lawn Tennis Club Championships at Wimbledon; total value å£252
"Imperial House, Imperial Drive, Rayners Lane, Harrow HA2 7JW",2coffey_therese.htm,hospitality received at Doncaster Races with a value of å£250
"2 Wellington Place, Leeds LS1 4AP",9davies_philip.htm,two tickets for Cheltenham with a value of å£250 (å£125 each)
"Imperial House, Imperial Drive, Rayners Lane, Harrow HA2 7JW",2robertson_laurence.htm,"hospitality at Conservative Party conference for my wife and me, approx. value å£200"
"Phase 2, 2 Crewe Road North, Edinburgh EH5 2XS",1whitford_philippa.htm,"hospitality at ADS' annual dinner, value å£109.61"
"Phase 2, 2 Crewe Road North, Edinburgh EH5 2XS",2whitford_philippa.htm,"hospitality at ADS industry dinner with SNP MPs, value å£92"