donoraddress,index,donationdesc
"Cooper House, 205 Hook Road, Chessington KT9 1EA",1russell-moyle_lloyd.htm,å£611.06 reimbursement of car hire costs during the General Election
"Winkfield Road, Ascot SL5 7HX",1robertson_laurence.htm,"a metal badge entitling the bearer to admittance to certain horse racing meetings in the UK during 2016. The badge is not available for purchase but its estimated value is between å£0 - å£1,000, depending on usage."
"Winkfield Road, Ascot SL5 7HX",3robertson_laurence.htm,"a metal badge entitling the bearer to admittance to certain horse racing meetings in the UK during 2017. The badge is not available for purchase but its estimated value is between å£0 - å£1,000, depending on usage."
"Roadway House, Bretton Way, Bretton, Peterborough PE3 8DD",1elphicke_charlie.htm,"secondment of parliamentary researcher from 17 January 2017 to 17 January 2018, value å£22,577"
"c/o Munro Wright and Wasbrough LLP, 7-8 Great James Street, London WC1N 3DF",3boles_nick.htm,"å£20,000 to support the research and writing of a forthcoming book"
private,1boles_nick.htm,"å£10,000 to support the research and writing of a forthcoming book"
private,2boles_nick.htm,"å£5,000 to support the research and writing of a forthcoming book"
"privateAmount of donation, or nature and value if donation in kind: healthcare with a value of å£3,402Date received: 12 January 2017Date accepted: 12 January 2017Donor status: individual(Registered 10 July 2017)",1donelan_michelle.htm,"healthcare with a value of å£3,402"
"East Grinstead House, East Grinstead RH19 1UA",1mann_scott.htm,"use of a caravan club demonstration motorhome, equivalent cost to hire and pitch å£2,200"
"America House, Rumford Court, Rumford Place, Liverpool L3 9DDAmount of donation or nature of value if donation in kind: reimbursement for flights and other travel expenses, including two nights at a hotel during EU referendum campaign, value å£1,713Date received: 26 July 2016Date accepted: 26 July 2016Donor status: company, no 09245454(Registered 18 August 2016)",1paterson_owen.htm,"reimbursement for flights and other travel expenses, including two nights at a hotel during EU referendum campaign, value å£1,713"
"271 Stansted Road, Bishop's Stortford CM23 2BT",1umunna_chuka.htm,"A suit with a value of å£1,600"
private,1martin_sandy.htm,"Use of a flat in London between 10 June and 10 July 2017, value å£1,440"
private,1jenkin_bernard.htm,"One day‰Ûªs shooting, estimated value å£700"
"Beach House, Golf Place, St Andrews KY16 9JA",1mcgovern_alison.htm,"Attendance at the British Open accompanied by a guest, value å£450"
"Musselburgh, East Lothian EH21 7RG",1whitfield_martin.htm,badge for the racecourse with a value of å£440
"BBC Blackstaff House, Bruce St, Belfast BT2 7GXAmount of donation or nature of value if donation in kind: reimbursement for expenses to appear on BBC ‰Û÷Spotlight‰Ûª programme 21 March 2017; flights å£238.43; hotel å£149.90; total value å£388.33Date received: 19 April 2017Date accepted: 19 April 2017Donor status: company, registration RC000057(Registered 21 April 2017)",6paterson_owen.htm,reimbursement for expenses to appear on BBC ‰Û÷Spotlight‰Ûª programme 21 March 2017; flights å£238.43; hotel å£149.90; total value å£388.33
"Phase 2, 2 Crewe Road North, Edinburgh EH5 2XS",3whitford_philippa.htm,"entrance to Farnborough International Airshow 2016, value å£36"
Surrey KT18 5LQ,2grayling_chris.htm,"two racecourse passes for 2016, total value å£450Date of receipt: 6 June 2016Date of acceptance: 6 June 2016Donor status: company, registration 01752969(Registered 26 July 2016)"
"17 White House Grove, Elvington, York YO41 4AL",2burden_richard.htm,"Two passes to British Touring Car Championship 2017 rounds, total value for year approx. å£785."
"17 White House Grove, Elvington, York YO41 4AL",1burden_richard.htm,Two passes to British Touring Car Championship 2016 rounds. Total value for year approx. å£750.
private,1afolami_bim.htm,"Ticket to the Conservative Summer Party, value å£1,500"
"The London Television Centre, Upper Ground, London SE1 9LT",1davies_mims.htm,"ticket to the National Television Awards, including food and drink, value å£1,028"
"The London Television Centre, Upper Ground, London SE1 9LT",1matheson_christian.htm,"ticket for the National Television Awards with a value of å£1,028"
"The London Television Centre, Upper Ground, London SE1 9LT",1adams_nigel.htm,"ticket to attend the National Television Awards with a value of å£1,028"
"PO Box 1010, Uxbridge UB8 9NT",2gray_james.htm,12 month season ticket for car parking at Chippenham Station; value å£944
"One Stratford Place, Montfitchet Road, London E20 1EJ",7davies_philip.htm,"one ticket to Royal Ascot, with a value of å£700"
"Marford Mill, Rossett, Wrexham LL12 0HL",1wiggin_bill.htm," one day‰Ûªs shooting at Catton Hall, South Derbyshire and one night‰Ûªs accommodation at Hoar Cross Hall Hotel Staffordshire; total value å£826.73Date of receipt of donation: 16 December 2016Date of acceptance of donation: 16 December 2016Donor status: Registered Industrial and Provident Society No 28488R(Registered 19 December 2016; updated 10 January 2017)6"
private,1hammond_philip.htm,"Dinner for my wife and me, value å£800 in total"
"Whitehall Place, London SW1A 2HE",1farron_tim.htm,honorary life membership as Leader of the Liberal Democrats; value å£735 pa plus å£367.50 entrance fee.
"Marford Mill, Rossett, Wrexham LL12 0HL",1clifton-brown_geoffrey.htm,"one day‰Ûªs shooting at Catton Hall (å£650), South Derbyshire and one night‰Ûªs accommodation (å£176.73) at Hoar Cross Hall Hotel Staffordshire; total value å£826.73Date of receipt of donation: 16 December 2016Date of acceptance of donation: 16 December 2016Donor status: Registered Industrial and Provident Society No 28488R(Registered 19 December 2016; updated 10 January 2017)6"
"Floor 6, 50 Eastbourne Terrace, London W2 6LG",2thomas_derek.htm,"One admission including dinner at national Rail Award valued at å£60 plus train travel valued at å£200, total å£260"
"America House, Rumford Court, Rumford Place, Liverpool L3 9DD",5paterson_owen.htm,"reimbursement for travel expenses (å£52.67), two nights accommodation (å£157), meals and sundries (å£176.65) for UK 2020 events at Conservative Party Conference; total å£386.32"
"House of Commons, London SW1A 0AA",1gray_james.htm,six dinners value å£40 each; thirteen breakfasts value å£14.25 each; total å£425.25
"Burnaston, Derbyshire DE1 9TA",3wheeler_heather.htm,"Ben Ball charity dinner for the Society of Motor Manufacturers & Traders, attended by me and my husband; å£275 per person plus å£28 taxis, total value å£578"
"Burnaston, Derbyshire DE1 9TA",2wheeler_heather.htm,"the Society of Motor Manufacturers & Traders Dinner, attended by me and a member of staff; value å£250 per person plus taxi fare å£14, total value å£514"
"55 Diamond Road, Crumlin BT29 4QY",4paterson_owen.htm,"Dinner at the Randox Polo event at Bushmills, NI, total value å£240 and estimated equivalent accommodation cost for two nights, value å£200; total å£440"
"PO Box 72288, London SW1P 9LBEstimate of the probable value (or amount of any donation): Travel and accommodation with a value of å£2,000Destination of visit: Israel and the West BankDates of visit: 25-30 September 2016Purpose of visit: Fact finding political delegation.(Registered 20 October 2016)",1pow_rebecca.htm,"Travel and accommodation with a value of å£2,000Destination of visit: Israel and the West BankDates of visit: 25-30 September 2016Purpose of visit: Fact finding political delegation.(Registered 20 October 2016)"
"Woodcote Park Clubhouse, Wilmerhatch Lane, Epsom KT 18 7EW",1grayling_chris.htm,"honorary membership for the duration of my time as the MP for Epsom and Ewell, valued at å£1,600 per annum"
"Pall Mall Clubhouse, 89 Pall Mall, London SW1Y 5HS",2field_mark.htm,"renewal of honorary membership; value å£1,535Date of receipt of donation: 9 December 2014; renewed 18 November 2016Date of acceptance of donation: 9 December 2014Donor status: company, registration 03570702(Registered 17 December 2013; updated 10 December 2014, 18 November 2015 and 02 February 2017)"
"128 Theobald‰Ûªs Road, Holborn, London WC1X 8TN",1nandy_lisa.htm,"Hotel accommodation for 4 nights, value å£1,360 in total"
"69 St James's Street, London SW1A 1PJ.",1field_mark.htm,"renewal of honorary membership; value å£1,350Date of receipt of donation: 31 December 2014Date of acceptance of donation: 31 December 2014Donor status: company, registration 00573221(Registered 26 January 2012; updated 5 February 2013, 17 March 2014, 12 August 2015 and 9 September 2016)"
"Unit 6 Down Business Park, 46 Belfast Road, Downpatrick, County Down BT30 9UPAmount of donation or nature of value if donation in kind: reimbursement of costs relating to a visit to Northern Ireland, accommodation å£126 and transport å£247.49; total å£373.49Date received: 15 September 2016Date accepted: 15 September 2016Donor status: company, registration NI 020172(Registered 23 September 2016)",2paterson_owen.htm,"reimbursement of costs relating to a visit to Northern Ireland, accommodation å£126 and transport å£247.49; total å£373.49"
"Floor 6, 50 Eastbourne Terrace, London W2 6LG",1thomas_derek.htm,"Two admissions including dinner at Cornwall Business Awards valued at å£120, plus one nights accommodation valued at å£165, total å£285"
"Imperial House, Imperial Drive, Rayners Lane, Harrow HA2 7JW",3davies_philip.htm," Two  invitations to Ladbrokes dinner at Conservative party conference, with a value of å£100 each; total value å£200"
"Central St Giles, St Giles High Street, London WC2H 8NU",1ghani_nusrat.htm,"one ticket for the BAFTA Film Awards and Dinner, value: å£1,239"
"Central St Giles, St Giles High Street, London WC2H 8NU",1whittingdale_john.htm,"one ticket for the BAFTA Film Awards and Dinner, value: å£1,239"
"PO Box 72288, London SW1P 9LB",1halfon_robert.htm,"Hotel accommodation during Conservative Party Conference, total value å£1,200"
"Wicksteed Leisure Ltd, Digby Street, Kettering, Northamptonshire NN16 8YJ",1baker_steve.htm,"From June 2017 to May 2018, accommodation in London, approx. value å£1,105 per calendar month; å£13,260 a year."
"Whitehall Place, London SW1A 2HE",1moran_layla.htm,"Complementary annual membership of the National Liberal Club, value å£1,102.50"
"St Christopher‰Ûªs Way, Burnham on Sea TA8 2PE",1heappey_james.htm,"Honorary golf club membership, annual value å£980"
"1 London Bridge Street, London SE1 9GF",1gove_michael.htm,"Whilst attending The Times Cheltenham Festival, two nights accommodation for myself plus one nights accommodation for two guests, total value å£850"
" 202 Kensington Church Street, London, W8 4DP",1kawczynski_daniel.htm,"Ticket for gala charity dinner on 5 December 2016, value å£760"
private,1greenwood_margaret.htm,"Accommodation during the general election campaign, value å£700"
"Venture Crescent, Nix's Hill Industrial Estate, Alfreton  DE55 7RA",2jenkin_bernard.htm,"Dinner, overnight stay and a day‰Ûªs shooting with a total value of å£650"
"West Terrace, Esh Winning, Durham DH7 9PT",1barron_kevin.htm,"invitation to the theatre, including overnight hotel accommodation for myself and my wife, total value å£600"
"Law Building, Museum Avenue, Cardiff CF10 3AX",1grieve_dominic.htm,"First class rail ticket, accommodation and dinner associated with delivery of annual public law lecture, to a value of å£531"
"16 Old Queen Street, London SW1H 9HP",3coffey_therese.htm,conference business dinner with a value of å£400
"Quartermile Two, 2 Lister Square, Edinburgh EH3 9GL",1docherty-hughes_martin.htm,"as part of an APPG on Scotch Whisky fact-finding visit to Islay, travel, accommodation and food from 7 to 8 October 2-016,  with a value of å£379.41"
"Quartermile Two, 2 Lister Square, Edinburgh EH3 9GL",1grady_patrick.htm,"as part of an APPG on Scotch Whisky fact-finding visit to Islay, travel, accommodation and subsistence with a value of å£379.41"
"Quartermile Two, 2 Lister Square, Edinburgh EH3 9GL",1ohara_brendan.htm,"as part of an APPG on Scotch Whisky fact-finding visit to Islay, travel, accommodation and subsistence with a value of å£379.41"
"Quartermile Two, 2 Lister Square, Edinburgh EH3 9GL",1bardell_hannah.htm,"as part of an APPG on Scotch Whisky fact-finding visit to Islay, travel, accommodation and subsistence with a value of å£379.41"
"Quartermile Two, 2 Lister Square, Edinburgh EH3 9GL",1brown_alan.htm,"as part of an APPG on Scotch Whisky fact-finding visit to Islay, travel, accommodation and subsistence with a value of å£379.41"
"77-79 Garnerville Rd, Belfast BT4 2NX",1lynch_holly.htm,"Invited to speak at the donor's annual conference in relation to my campaign against assaults on police officers. Flights å£249.94; bed and breakfast å£95, dinner å£35; lunch å£20; total value å£399.94"
"55 Diamond Road, Crumlin BT29 4QY",3paterson_owen.htm,"Dinner for my wife and me at the Randox Polo International event at Gleneagles, total value å£240."
"Phase 2, 2 Crewe Road North, Edinburgh EH5 2XS",4whitford_philippa.htm,"ADS guest at CBI Scotland Dinner, value å£180"
"4th floor, 49 Whitehall, London SW1A 2BXAmount of donation, or nature and value if donation in kind: Two tickets for Glastonbury, value å£900, received because of my role in relation to DCMSDate received: 21 June 2017Date accepted: 21 June 2017Donor status: company, registration 03245288(Registered 07 July 2017)",2haigh_louise.htm,"Two tickets for Glastonbury, value å£900, received because of my role in relation to DCMS"
"Ramillies Buildings, 1-9 Hills Pl, London W1F 7SA",1bone_peter.htm,"two tickets with hospitality for NFL game at Wembley, with a total value of å£880Date of receipt of donation: 2 October 2016Date of acceptance of donation: 2 October 2016Donor status: company, registration 02777555(Registered 04 October 2016)"
"75 High Holborn, London WC1V 6LS",6robertson_laurence.htm,"hospitality for my wife and me at Cheltenham Races, approx. total value å£600Dates received: 13 and 17 March 2017Date accepted: 13 March 2017Donor status: company, registration 2909409.(Registered 26 April 2017)"
"Floor 2, Aspire House, Sitwell Street, Derby DE1 2JT",2latham_pauline.htm,"Tickets for a concert, and associated hospitality, for myself and my husband, with a value of å£550 per person, total å£1,100"
"30 Gloucester Place, London W1U 8PL",1lammy_david.htm, hospitality with a value of å£528 at FA cup
"Worthy Farm, Pilton, Shepton Mallet BA4 4BY",1corbyn_jeremy.htm,"Two tickets to Glastonbury, total value å£476, given to a member of my family"
"Imperial House, Imperial Drive, Rayners Lane, Harrow HA2 7JW",1davies_philip.htm,"three tickets for the Community Shield at Wembley Stadium with a value of å£45 each, total å£135"
"Severn Lodge, Alvington GL15 6BQ",2heappey_james.htm,"two tickets for the NOEA Awards Evening with a value of å£372, plus hotel stay worth å£180, total value å£552Date accepted: 24 November 2016"
"4th floor, 49 Whitehall, London SW1A 2BXAmount of donation, or nature and value if donation in kind: Ticket and hospitality for the Ivor Novello awards, value å£370, received because of my role in relation to DCMSDate received: 18 May 2017Date accepted: 18 May 2017Donor status: company, registration 03245288(Registered 07 July 2017)",3haigh_louise.htm,"Ticket and hospitality for the Ivor Novello awards, value å£370, received because of my role in relation to DCMS"
"Red Hall, Red Hall Lane, Leeds LS17 8NB",1twigg_derek.htm,Two tickets and hospitality to the value of å£360 received for the Rugby League Grand Final
"Imperial House, Imperial Drive, Rayners Lane, Harrow HA2 7JW",6davies_philip.htm,"two tickets and hospitality at Cheltenham Races, with a value of å£350 each, total å£700"
"5th Floor, The Zig Zag Building, 70 Victoria Street, London SW1E 6SG",5robertson_laurence.htm,"two tickets and hospitality for my wife and me at Cheltenham Races, with a value of å£350 each, total å£700"
"5th Floor, The Zig Zag Building, 70 Victoria Street, London SW1E 6SQ",8robertson_laurence.htm,"three tickets and hospitality for my senior parliamentary assistant, my wife and me at Ascot Racecourse, with a value of å£350 each, total å£1,050"
"Greenside House, 50 Station Road, Wood Green, London N22 7TP",9robertson_laurence.htm,"two tickets and hospitality for my wife and me at Ascot Racecourse, with a value of å£350 each, total å£700"
"One Stratford Place, Montfitchet Road, London E20 1EJ",5davies_philip.htm,"two tickets and hospitality at Cheltenham Races, with a value of å£300 each, total å£600"
"One Stratford Place, Montfitchet Road, London E20 1EJ",4robertson_laurence.htm,"two tickets and hospitality for my wife and me at Cheltenham Races, with a value of å£300 each, total å£600"
"Craigneuk Avenue, Airdrie ML6 8QZ",1gray_neil.htm,"two hospitality tickets to see Elton John concert held within constituency, value å£250 each, total value å£500."
"One Stratford Place, Montfitchet Road, London E20 1EJ",4davies_philip.htm,"two tickets and hospitality at Coral Sprint Trophy in York, with a value of å£250 each, total å£500"
"Burnaston, Derbyshire DE1 9TA",1wheeler_heather.htm,"football match & lunch tickets, for me and my husband, to Derby County's Pride Park ground; å£150 per person, total value å£300"
could not extract,13bercow_john.htm,"two tickets for the Royal Box at the Wimbledon championships on 13 July 2017, estimated value å£8,590"
"Auchterarder, Perthshire PH3 1NF",1bercow_john.htm,"whilst undertaking a visit in my capacity as Speaker, for a member of staff and myself, one night's accommodation and hospitality with a total value of å£2,815"
"25 Argyll Street, London W1F 7TU",1watson_tom.htm,"Five tickets with hospitality to attend Glastonbury Festival, total value å£2,445"
"The London Television Centre, Upper Ground, London SE1 9LTAmount of donation, or nature and value if donation in kind: Two tickets to the Six Nations Rugby, and accompanying hospitality, value å£2,012Date received: 11 March 2017Date accepted: 11 March 2017Donor status: company, registration 4967001(Registered 28 March 2017)",2davies_mims.htm,"Two tickets to the Six Nations Rugby, and accompanying hospitality, value å£2,012"
"Capestone Farm, Walwyn's Castle, Haverfordwest SA62 3DY",2crabb_stephen.htm,"Two M & S Charity Ball tickets with a value of å£2,000"
"124-126 Horseferry Rd, Westminster, London SW1P 2TX",2collins_damian.htm,"two tickets to the BAFTAs, total value including hospitality å£1,840"
"124 Horseferry Road, London SW1P 2TX",1haigh_louise.htm,"In my role as Shadow Minister for Culture, Media and Sport, two tickets and hospitality at the British Film and Television Awards ceremony, value å£1,840"
"124 Horseferry Road, London SW1P 2TX",1huddleston_nigel.htm,"in my capacity as a member of the Culture, Media and Sport Committee, hospitality for myself and my wife at the BAFTAs with a total value of å£1,840 (å£920 per person)"
"124 Horseferry Road, London SW1P 2TX",1loughton_tim.htm,"Tickets for my wife and me to attend the BAFTA ceremony at the Royal Albert Hall followed by official dinner, total value of å£1,840 (å£920 per person)"
"124 Horseferry Road, London SW1P 2TX",2adams_nigel.htm,"In my role on the culture, media and sport select committee I was invited to and accepted two tickets and hospitality at the British Film and Television Awards ceremony, value å£1,840"
"Stamford Bridge, Fulham Road, London SW6 1HS",1vaizey_edward.htm,"two tickets, including hospitality, to a football match at Chelsea Football Club, value å£1,428"
"National Tennis Centre, 100 Priory Lane, London SW15 5JQ",2bercow_john.htm,"Two tickets, with associated hospitality, for the Davis Cup semi final at the Emirates Arena in Glasgow between 16 and 18 September 2016, value å£1,384.80"
"Talbot Athletic Ground, Manor St, Port Talbot SA13 1AB",1kinnock_stephen.htm,"Wales v England match tickets for me and my wife with a total value of å£1,280"
"The London Television Centre, Upper Ground, London SE1 9LT",4coffey_therese.htm,"hospitality for me and a guest to the Grand National, total value å£1,125.60"
"2 Pancras Square, London N1C 4AG",4collins_damian.htm,"two tickets, including hospitality, for the Glastonbury Festival value with a value of å£1,108.32"
"2 Pancras Square, London N1C 4AG",2brine_steve.htm,"Two tickets to Glastonbury and accommodation with a total value of å£1,108.32 (å£950 for tickets and å£158.32 for accommodation)"
"Riverside Park, Colnbrook SL3 0HG",3burden_richard.htm,"two passes and hospitality for 2017 British Grand Prix at Silverstone, value å£1,084 (å£542 per person)"
"The London Television Centre, Upper Ground, London SE1 9LT",3collins_damian.htm,"ticket, including hospitality, for the National Television Awards with a value of å£1,028"
"2 Pancras Square, London N1C 4AG",3adams_nigel.htm,"In my capacity as Chairman of the All Party Parliamentary Group for Music, I received two tickets and accommodation at Glastonbury music festival to the value of å£1,019.46"
"75 High Holborn, London WC1V 6LS",7robertson_laurence.htm,"hospitality at Aintree Racecourse, approx. value å£1,000"
"30 Leicester Square, London WC2H 7LA",2vaizey_edward.htm,"four tickets and hospitality to Capital FM Summertime Ball with a value of å£1,000"
"6 Catherine St, London WC2B 5JJ",1stevenson_john.htm,"Hospitality at several dinners, with an estimated total value of å£850"
"Stradey Park Business Centre, Llangennech, Llanelli SA14 8YP",3crabb_stephen.htm,"Four tickets with hospitality for the Wales v Argentina match at the Principality Stadium, Cardiff, value å£833.36"
"3 Market Close, Poole BH15 1NQ",1penrose_john.htm,"hospitality and rugby pass for England v Scotland at Twickenham (Calcutta Cup), value å£828"
"Highbury House, 75 Drayton Park, London N5 1BU",9bercow_john.htm,"three tickets to attend a football match on 22 January 2017, and associated hospitality; total value å£825"
private,4bercow_john.htm,"two tickets to attend a football match on 19 November 2016, and associated hospitality; total value å£810"
"The Ageas Bowl, Botley Road, West End, Southampton SO30 3XH",1jayawardena_ranil.htm,"two tickets, with hospitality, for the England v South Africa ODI, with an approx. value å£800"
"Grant Way, Isleworth TW7 5QD",1brine_steve.htm,"Two tickets to the British Masters at the Grove Golf Club, with a value of å£800"
"30 Gloucester Place, London W1U 8PL",1hands_greg.htm,"three tickets and hospitality to FA Cup Semi-Final (Chelsea v Tottenham Hotspur), total value å£792"
"100 Priory Lane, Roehampton, London SW15 5JQ",1pursglove_tom.htm,"two tickets and associated hospitality to ATP World Tour Finals, with a  total value of å£790 (å£395 each)"
"The London Television Centre, Upper Ground, London SE1 9LT",3davies_mims.htm,"Ticket to Royal Ascot, with accompanying hospitality, value å£718.80"
"Stamford Bridge, Fulham Road, London, SW6 1HS",1collins_damian.htm,"a ticket to watch Chelsea v Man Utd, total value including hospitality å£714"
"50 Station Road, Wood Green, London N22 7TP",8davies_philip.htm,two tickets to Royal Ascot with a value of å£700 (å£350 per person)
"Garavi Gujarat House, 1-2 Silex Street, London SE1 0DW",1vara_shailesh.htm,"Two tickets plus hospitality at a football match at Stamford Bridge, total value å£677.04 (å£338.52 per person)"
"55 Blandford Street, London W1U 7HW",1betts_clive.htm,"two tickets and hospitality to watch Sheffield Wednesday FC at Wembley in the Championship Playoff Final, total estimated value å£650"
"Imperial House, Imperial Drive, Rayners Lane, Harrow HA2 7JW",1coffey_therese.htm,"for a member of staff and myself, hospitality at Royal Ascot with a value of å£640 (å£320 per person)"
"Palliser Road, West Kensington, London W14 9EQ",3leslie_chris.htm,"two tickets, with associated hospitality, for the Aegon Championships; total value å£630"
"Palliser Road, London W14 9EQ",12bercow_john.htm,"two tickets to attend the Aegon Championships, with associated hospitality; value å£630"
"Twickenham Stadium, 200 Whitton Road, Twickenham TW2 7BA",2fallon_michael.htm,"Two tickets with hospitality for myself and my wife for the Six Nations England vs Scotland match, value å£608"
"National Tennis Centre, 100 Priory Lane, Roehampton, London SW15 5JQ",1evans_chris.htm,"One ticket with hospitality to the ATP World Tour Finals, total value å£605"
"National Tennis Centre, 100 Priory Lane, Roehampton, London SW15 5JQ",2leslie_chris.htm,One ticket with hospitality to the ATP World Tour Finals; total value å£605
"Stamford Bridge, London SW6 1HS",2hands_greg.htm,"2 tickets to Chelsea v Sunderland, including hospitality in the Director's Box, with an estimated total value of å£600"
private,1green_damian.htm,"Ticket with hospitality for a rugby international at Twickenham, value å£599.70"
"London Television Centre, Upper Ground, London SE1 9LT",1nokes_caroline.htm,ticket and hospitality to the Royal Ascot with a value of å£599
"Highbury House, 75 Drayton Park, London N5 1BU",3bercow_john.htm,"two tickets to attend a football match on 6 November 2016, and associated hospitality; total value å£550"
"Highbury House, 75 Drayton Park, London N5 1BU",10bercow_john.htm,"two tickets to attend a football match on 31 January 2017, and associated hospitality; total value å£550"
